<?xml version="1.0" encoding="UTF-8"?>
<biblioteca 
  xmlns:xsi="http://www.w3.org/2001/XMLSchema-instance"
  xsi:noNamespaceSchemaLocation="biblioteca.xsd">
  <libro>
    <titulo>Cien años de soledad</titulo>
    <autor>Gabriel García Márquez</autor>
    <año>1967</año>
  </libro>
  <libro>
    <titulo>El amor en los tiempos del cólera</titulo>
    <autor>Gabriel García Márquez</autor>
    <año>1985</año>
  </libro>
  <libro>
    <titulo>Rayuela</titulo>
    <autor>Julio Cortázar</autor>
    <año>1963</año>
  </libro>
</biblioteca>
